{
  "SellerName": "Crimson Forge",
  "SellerEmail": "hello@crimsonforge.com",
  "SellerAddress": "626 Chestnut Blvd, Fairview",
  "SellerPhone": "(548) 519 5261",
  "BuyerName": "Casey Wilson",
  "BuyerEmail": "casey@clarkmail.com",
  "BuyerAddress": "425 Oak Street, Springfield",
  "BuyerPhone": "076 257 38237",
  "InvoiceNumber": "INV1005",
  "InvoiceDate": "2025-06-11",
  "PaymentTerms": "Net 30",
  "DueDate": "2025-07-11",
  "LineItems": [
    {
      "Description": "Content writing",
      "UnitPriceAmount": 359,
      "Quantity": 1,
      "LineAmount": 359
    }
  ],
  "SubtotalAmount": 359,
  "TaxDescription": "Tax (5%)",
  "TaxAmount": 17.95,
  "TotalAmount": 376.95,
  "BalanceDueAmount": 376.95,
  "Notes": "Payment due within 30 days. Thank you for your business!"
}
