{
  "SellerName": "Nova Vertex",
  "SellerEmail": "hello@novavertex.com",
  "SellerAddress": "583 Birch Court, Riverside",
  "SellerPhone": "(536) 909 3126",
  "BuyerName": "Alex Clark",
  "BuyerEmail": "alex@johnsonmail.com",
  "BuyerAddress": "847 Elm Drive, Franklin",
  "BuyerPhone": "088 639 69371",
  "InvoiceNumber": "INV1006",
  "InvoiceDate": "2024-12-23",
  "PaymentTerms": "Net 30",
  "DueDate": "2025-01-22",
  "LineItems": [
    {
      "Description": "App development",
      "UnitPriceAmount": 277.99,
      "Quantity": 3,
      "LineAmount": 833.97
    },
    {
      "Description": "SEO consulting",
      "UnitPriceAmount": 330,
      "Quantity": 4,
      "LineAmount": 1320
    }
  ],
  "SubtotalAmount": 2153.97,
  "TaxDescription": "Tax (12%)",
  "TaxAmount": 258.48,
  "TotalAmount": 2412.45,
  "BalanceDueAmount": 2412.45,
  "Notes": "A late fee of 2% applies after the due date."
}
