{
  "SellerName": "Silverline Labs",
  "SellerEmail": "hello@silverlinelabs.com",
  "SellerAddress": "311 Pine Road, Madison",
  "SellerPhone": "(285) 499 3792",
  "BuyerName": "Emerson Jackson",
  "BuyerEmail": "emerson@mooremail.com",
  "BuyerAddress": "653 Maple Ave, Franklin",
  "BuyerPhone": "071 649 48480",
  "InvoiceNumber": "INV1007",
  "InvoiceDate": "2025-05-21",
  "PaymentTerms": "Net 15",
  "DueDate": "2025-06-05",
  "LineItems": [
    {
      "Description": "Consulting hours",
      "UnitPriceAmount": 485,
      "Quantity": 1,
      "LineAmount": 485
    }
  ],
  "SubtotalAmount": 485,
  "TaxDescription": "Tax (8%)",
  "TaxAmount": 38.8,
  "TotalAmount": 523.8,
  "BalanceDueAmount": 523.8,
  "Notes": "Thank you for choosing us for your project."
}
