{
  "SellerName": "Bluepeak Studio",
  "SellerEmail": "hello@bluepeakstudio.com",
  "SellerAddress": "378 Chestnut Blvd, Riverside",
  "SellerPhone": "(818) 375 2786",
  "BuyerName": "Jamie Clark",
  "BuyerEmail": "jamie@smithmail.com",
  "BuyerAddress": "441 Elm Drive, Greenville",
  "BuyerPhone": "046 302 87241",
  "InvoiceNumber": "INV1009",
  "InvoiceDate": "2025-12-16",
  "PaymentTerms": "Net 15",
  "DueDate": "2025-12-31",
  "LineItems": [
    {
      "Description": "Video editing",
      "UnitPriceAmount": 176.99,
      "Quantity": 1,
      "LineAmount": 176.99
    },
    {
      "Description": "App development",
      "UnitPriceAmount": 242,
      "Quantity": 5,
      "LineAmount": 1210
    },
    {
      "Description": "Photography session",
      "UnitPriceAmount": 113.99,
      "Quantity": 1,
      "LineAmount": 113.99
    }
  ],
  "SubtotalAmount": 1500.98,
  "TaxDescription": "Tax (8%)",
  "TaxAmount": 120.08,
  "TotalAmount": 1621.06,
  "BalanceDueAmount": 1621.06,
  "Notes": "Payment due within 30 days. Thank you for your business!"
}
