{
  "SellerName": "Crimson Forge",
  "SellerEmail": "hello@crimsonforge.com",
  "SellerAddress": "307 Pine Road, Springfield",
  "SellerPhone": "(833) 598 3852",
  "BuyerName": "Emerson Thompson",
  "BuyerEmail": "emerson@andersonmail.com",
  "BuyerAddress": "821 Maple Ave, Riverside",
  "BuyerPhone": "022 383 48042",
  "InvoiceNumber": "INV1002",
  "InvoiceDate": "2025-10-19",
  "PaymentTerms": "Net 30",
  "DueDate": "2025-11-18",
  "LineItems": [
    {
      "Description": "Social media management",
      "UnitPriceAmount": 53,
      "Quantity": 1,
      "LineAmount": 53
    },
    {
      "Description": "Brand identity package",
      "UnitPriceAmount": 414,
      "Quantity": 4,
      "LineAmount": 1656
    },
    {
      "Description": "Consulting hours",
      "UnitPriceAmount": 345,
      "Quantity": 5,
      "LineAmount": 1725
    },
    {
      "Description": "Website design",
      "UnitPriceAmount": 245.99,
      "Quantity": 3,
      "LineAmount": 737.97
    }
  ],
  "SubtotalAmount": 4171.97,
  "TaxDescription": "Tax (12%)",
  "TaxAmount": 500.64,
  "TotalAmount": 4672.61,
  "BalanceDueAmount": 4672.61,
  "Notes": "Payment due within 30 days. Thank you for your business!"
}
