{
  "SellerName": "Silverline Labs",
  "SellerEmail": "hello@silverlinelabs.com",
  "SellerAddress": "615 Maple Ave, Clinton",
  "SellerPhone": "(605) 986 1899",
  "BuyerName": "Finley Williams",
  "BuyerEmail": "finley@andersonmail.com",
  "BuyerAddress": "568 Pine Road, Franklin",
  "BuyerPhone": "080 573 11084",
  "InvoiceNumber": "INV1008",
  "InvoiceDate": "2025-01-30",
  "PaymentTerms": "Net 7",
  "DueDate": "2025-02-06",
  "LineItems": [
    {
      "Description": "Video editing",
      "UnitPriceAmount": 83.99,
      "Quantity": 4,
      "LineAmount": 335.96
    },
    {
      "Description": "App development",
      "UnitPriceAmount": 257,
      "Quantity": 3,
      "LineAmount": 771
    },
    {
      "Description": "Photography session",
      "UnitPriceAmount": 363,
      "Quantity": 2,
      "LineAmount": 726
    },
    {
      "Description": "Content writing",
      "UnitPriceAmount": 214,
      "Quantity": 5,
      "LineAmount": 1070
    }
  ],
  "SubtotalAmount": 2902.96,
  "TaxDescription": "Tax (12%)",
  "TaxAmount": 348.36,
  "TotalAmount": 3251.32,
  "BalanceDueAmount": 3251.32,
  "Notes": "Payment due within 30 days. Thank you for your business!"
}
