{
  "SellerName": "Hexcore Solutions",
  "SellerEmail": "hello@hexcoresolutions.com",
  "SellerAddress": "219 Maple Ave, Greenville",
  "SellerPhone": "(922) 615 8620",
  "BuyerName": "Alex Thompson",
  "BuyerEmail": "alex@martinmail.com",
  "BuyerAddress": "258 Pine Road, Clinton",
  "BuyerPhone": "018 348 76380",
  "InvoiceNumber": "INV1010",
  "InvoiceDate": "2024-04-25",
  "PaymentTerms": "Net 14",
  "DueDate": "2024-05-09",
  "LineItems": [
    {
      "Description": "Brand identity package",
      "UnitPriceAmount": 307,
      "Quantity": 1,
      "LineAmount": 307
    },
    {
      "Description": "SEO consulting",
      "UnitPriceAmount": 349,
      "Quantity": 1,
      "LineAmount": 349
    }
  ],
  "SubtotalAmount": 656,
  "TaxDescription": "Tax (10%)",
  "TaxAmount": 65.6,
  "TotalAmount": 721.6,
  "BalanceDueAmount": 721.6,
  "Notes": "Payment due within 30 days. Thank you for your business!"
}
