{
  "SellerName": "Bluepeak Studio",
  "SellerEmail": "hello@bluepeakstudio.com",
  "SellerAddress": "846 Birch Court, Springfield",
  "SellerPhone": "(781) 550 8267",
  "BuyerName": "Cameron Davis",
  "BuyerEmail": "cameron@robinsonmail.com",
  "BuyerAddress": "327 Chestnut Blvd, Georgetown",
  "BuyerPhone": "012 358 64865",
  "InvoiceNumber": "INV1003",
  "InvoiceDate": "2024-02-19",
  "PaymentTerms": "Next Day",
  "DueDate": "2024-02-20",
  "LineItems": [
    {
      "Description": "Photography session",
      "UnitPriceAmount": 342.99,
      "Quantity": 1,
      "LineAmount": 342.99
    },
    {
      "Description": "Website design",
      "UnitPriceAmount": 493,
      "Quantity": 1,
      "LineAmount": 493
    },
    {
      "Description": "Monthly hosting",
      "UnitPriceAmount": 108,
      "Quantity": 4,
      "LineAmount": 432
    }
  ],
  "SubtotalAmount": 1267.99,
  "TaxDescription": "Tax (12%)",
  "TaxAmount": 152.16,
  "TotalAmount": 1420.15,
  "BalanceDueAmount": 1420.15,
  "Notes": "Thank you for choosing us for your project."
}
