{
  "SellerName": "Bluepeak Studio",
  "SellerEmail": "hello@bluepeakstudio.com",
  "SellerAddress": "437 Oak Street, Georgetown",
  "SellerPhone": "(922) 681 6364",
  "BuyerName": "Avery Miller",
  "BuyerEmail": "avery@johnsonmail.com",
  "BuyerAddress": "898 Cedar Lane, Springfield",
  "BuyerPhone": "047 458 13801",
  "InvoiceNumber": "INV1001",
  "InvoiceDate": "2025-04-01",
  "PaymentTerms": "Net 45",
  "DueDate": "2025-05-16",
  "LineItems": [
    {
      "Description": "Brand identity package",
      "UnitPriceAmount": 275.99,
      "Quantity": 1,
      "LineAmount": 275.99
    },
    {
      "Description": "Website design",
      "UnitPriceAmount": 280,
      "Quantity": 4,
      "LineAmount": 1120
    },
    {
      "Description": "SEO consulting",
      "UnitPriceAmount": 300,
      "Quantity": 2,
      "LineAmount": 600
    },
    {
      "Description": "Consulting hours",
      "UnitPriceAmount": 153.99,
      "Quantity": 5,
      "LineAmount": 769.95
    }
  ],
  "SubtotalAmount": 2765.94,
  "TaxDescription": "Tax (5%)",
  "TaxAmount": 138.3,
  "TotalAmount": 2904.24,
  "BalanceDueAmount": 2904.24,
  "Notes": "Bank transfer details available upon request."
}
